en,ko
The idea that aliens landed in New York City is a bunch of hogwash.,외계인이 뉴욕에 착륙했다는 생각은 말도 안 되는 소리입니다.
I finally got to the bottom of why he was angry at me.,왜 그가 나에게 화가 나 있는지 마침내 알게 되었다.
That guy over there is my neighbor.,저기 있는 남자가 내 이웃이에요.
Don't let the administration off the hook.,정부의 잘못을 봐주면 안 돼요.
We shelled out a lot of money to eat at that fancy restaurant.,우리는 그 고급 레스토랑에서 돈을 많이 썼어요.
"Inn trying to build a house by himself, he had bitten off more than he could chew.","그는 혼자 집을 지으려고 했지만, 그에게는 힘에 벅찬 일이었다."
His surprise birthday party was canceled because someone let the cat out of the bag.,누군가가 비밀을 말해줘서 그의 깜짝 생일 파티는 취소되었습니다.
"After a long, tiring day, you need a good night's sleep, and then you will be right as rain the following day.",길고 피곤한 하루를 보낸 후엔 숙면을 취하면 다음날 괜찮아 질 거야.
"Bill Jones, Jr., is a chip off the old block. He's a banker just like his father. ",빌 존스 주니어는 아버지와 똑같다. 그는 또 아버지와 마찬가지로 은행가이다.
She made the chocolate from scratch.,그녀는 초콜릿을 처음부터 만들었다.
When I tried to argue about my fine for a traffic violation the judge charged me with contempt of court. I really went out of the frying pan into the fire. ,"교통 위반으로 벌금이 부과되어 내가 항변하려고 하니까, 재판관은 내게 법정 모독죄를 적용하였다. 엎친 데 덮친 격이 되고 말았다."
I saw red when he told me that he wouldn't be at work tomorrow.,그가 내일 출근하지 않을 거라고 나에게 말했을 때 나는 몹시 화가 났습니다.
I spent all money last weekend. So I need some plan to cut corners.,나는 지난 주말 돈을 다 써버렸어. 그래서 돈을 아껴쓸 계획을 세워야겠어.
His boss conned him into working on the weekend for no pay.,그의 상사는 그가 주말에 무보수로 일하도록 속였습니다.
"Let's take a rain check. First of all, you better pull yourself together.","다음을 기약합시다, 일단 네 마음을 가다듬는게 좋겠어."
"you're barking up the wrong tree, pal.",사람을 잘못 찾아왔다고요.
Covid rained on the whole world's parade and took away their happinness.,코로나가 온 세계를 다 망쳐놨어. 모든 행복을 다 가져갔어.
 Mind if I take a rain check on that drink? I've got to work late tonight.,그 음료는 다음 기회로 미뤄도 될까요? 오늘 밤 늦게까지 일해야 해요.
He can’t pay his bills either. He is in the same boat as you.,그 또한 빚을 갚을 수 없어 어려운 상황에 처해 있습니다. 그는 당신과 같은 처지입니다.
"Whenever I try to bake something, I find that the devil is in the detail.","베이킹 할 때마다 느끼는 건데, 한끗 차이 더라고요."
Don't harp on losing your job; it only makes you more depressed.,실직에 연연하지 마세요. 그것은 당신을 더 우울하게 만들 뿐입니다.
"Many people have got on the bandwagon of protest, diluting the real issues and making a mockery of protestors' problems.",많은 사람들이 시위의 흐름에 편승하여 실제 문제를 희석시키고 시위자들의 문제를 조롱했습니다.
May be you should just call it a day.,그냥 이만 끝내는 것이 좋을거야.
I can tell by the way she spoke that she was loaded.,그녀가 말을 하는 것을 보면 술에 취했다는 것을 알 수 있습니다.
"He said he didn't want the job anway, but that's just sour grapes.","그는 어차피 자기도 그 직장을 원한 것은 아니었다고 말하지만, 그것은 그냥 오기였다."
Mary's daughter only visits her once in a blue moon.,메리의 딸은 그녀를 거의 찾아오지 않는다.
I still can't wrap my brain around it.,나는 아직도 이해흘 못 하겠어.
This is so random.,정말 뜬금없네.
The travel industry experienced a perfect storm due to COVID-19.,여행 업체는 코로나로 인해 최악의 시나리오를 경험했다.
"Now that most of the inventory is done, we are beginning to see daylight.",이제 대부분의 재고가 완료되어 햇빛을 보기 시작했습니다.
I know a way we can make a fast buck.,돈을 빨리 벌 수 있는 방법을 알고 있습니다.
Holy Mackerel! Look at that man's motorcycle.,우와! 저 남자의 오토바이 봐.
Relationship and compromise are like two peas in a pod.,관계와 타협은 한 덩어리의 두 완두콩과 같이 똑같습니다.
Resolve a small problem on time may prevent a big trouble it's like the old saying a stitch in time saves nine.,작은 문제를 제 시간에 해결하면 큰 문제를 예방할 수 있습니다. 한 바늘땀이 아홉 바늘을 절약한다는 옛말과 같습니다.
Do you think maybe you’ve gone overboard?,아마도 너무 과도한 것 같아요?
She reminded me that I had to prepare for my trip out of town. I wish she would get off my back.,그녀는 제가 지방 여행을 준비해야 한다는 것을 상기시켜 주었습니다. 저는 그녀가 잔소리를 그만 했으면 좋겠습니다.
She has always seemed distant and secretive. She has many skeletons in her closet.,그녀는 언제나 먼지 같이 멀리하고 비밀스럽게 보였어요. 그녀는 많은 비밀을 간직하고 있어요.
She knew her coworkers will eventually forget how she messed up the filing system in the office. She couldn’t wait for the incident to blow over.,그녀는 동료들이 사무실의 서류 정리 시스템을 얼마나 엉망으로 만들었는지 결국 잊을 것이라는 것을 알고 있었습니다. 그녀는 사건이 터질 때까지 기다릴 수 없었습니다.
She put her cards on the table and told everyone what she really thought.,"그녀는 솔직하게, 그녀의 진짜 생각을 모두에게 말했습니다."
He held back his feelings and acted as if everything was alright.,그는 자신의 감정을 억누르고 마치 모든 것이 괜찮은 것처럼 행동했습니다.
He realized he could get along without his partner.,그는 파트너 없이도 잘 지낼 수 있다는 것을 깨달았다.
The car salesman came on too strong and angered my wife.,자동차 판매원이 지나치게 격한 말로 압도하고 아내를 화나게 했습니다.
"If you go and visit him, you are running the risk of getting sick too.",병문안을 가면 병에 걸릴 위험도 있습니다.
She thinks she is better than everyone else. She always looks down her nose at others.,그녀는 자신이 다른 사람들보다 낫다고 생각합니다. 그녀는 항상 다른 사람들을 무시합니다.
She's peachy.,그녀는 정말 멋져.
Her comment really hit below the belt.,그녀의 말은 누군가에게 잔인하고 부당하게 상처를 주었습니다.
It is good to keep vaccinations up to date as An ounce of prevention is worth a pound of cure.,예방은 치료보다 낫다는 말이 있기 때문에 예방 접종을 최신 상태로 유지하는 것이 좋습니다.
"That boy wants to be the captain of the team, but does he cut the mustard?","저 소년은 팀의 주장이 되고 싶어하지만, 그는 성공하나요?"
That'st the last straw. I can't take any more of your complaning about every little thing.,참을 만큼 참았다. 사소한 모든것에 불평하는 너를 견디지 못하겠어.
"When she couldn't go to school because of her illness, she significantly fell behind in her work.","그녀는 병 때문에 학교에 갈 수 없게 되자, 일에서 크게 뒤쳐졌습니다."
"Harvey, eye on the ball. This issue here is you tried to torpedo a client.","하비, 중요한 일에 집중해, 중요한 건 자네가 의뢰인에게 한방 먹이려고 한건데."
It really is incredibly weird when you wrap your head around it.,자네가 그것을 이해할 때 정말이지 믿을 수 없을 정도로 오싹하다.
"Breaking up with someone is always very difficult, but don't go making matters worse by doing it in a very public place.","누구랑 헤어지는 것은 언제나 어렵다, 설상가상으로 매우 공개적인 장소에서 함으로써 상황을 더욱 난처하게 하지 말아라."
"I have been bit once, and have made a vow never to settle upon any woman while I live, again. ",난 한번 물린 경험이 있다. 그리고 내가 살아있는 동안 다시는 어떤 여자에게도 정착하지 않으리라 맹세했다.
"A penny for your thoughts, sweetheart?","울 애기, 무슨 생각해?"
"I put in my two cents, so that everyone knew how I felt.",저는 제 마음을 모두가 알 수 있도록 제 의견을 말했습니다.
I think I might be barking up the wrong tree.,내가 아무래도 방향을 잘 못 짚은 것 같아요.
"Even though she only made a meager salary, she was still able to buy clothes, go to restaurants, and keep her head above water.","비록 그녀는 겨우 적은 월급을 벌었지만, 여전히 옷을 사고, 식당을 가고, 수입으로 생활할 수 있었습니다."
I am tired of working so hard. I just want to stay home and goof off.,저는 너무 열심히 일하는 것에 지쳤어요. 그냥 집에 있으면서 놀고 싶어요.
keeping your team in by the skin of your teeth isn't sufficient qualification for captaincy.,팀을 간신히 유지시킨다면 주장으로서의 자격이 충분하지 않.
"He’s very angry today. Every time I ask him a question, he jumps down my throat.",오늘 화가 많이 나셔서 제가 질문을 할 때마다 화가 나서 급하게 비판을 해요.
"It is not my idea of a perfect job, but at least I have my foot in the door with a great company.",완벽한 직장은 아니지만 적어도 나는 위대한 회사에 발을 담궜어.
I want to get even with her.,그녀에게 복수하고 싶다.
"Now you have to forget about her. Don't cry over spilt milk, she's married.",너는 이제 그녀를 잊어야 해. 이미 후회하긴 늦었어. 그녀는 결혼했어.
It's all about money.,돈이 최고야.
Our old TV didn’t work yesterday. I guess it finally bit the dust.,어제 우리 옛날 TV가 작동을 안 했어요. 드디어 고장났나 봐요.
Remember to plan your hike before venturing into the wilderness; the devil is in the details.,길을 떠나기 전에 여정을 계획하라는 말을 기억하세요. 사소한 것 같아도 빠뜨리면 절대 안 되는 거에요.
The offer on the table is a 10% wage increase.,고려하고 있는 제안은 10% 월급 인상이다.
I'll cross that bridge when I come to it.,그때 가서 생각할거야.
Let's call the movie theater in advance and see if they have any tickets left.,영화관에 미리 전화해서 표가 남았는지 알아보겠습니다.
I'll report my manager to make a long story short.,간단히 말하기 위해서 매니저에게 보고 할 예정 이다.
"He was once a top athlete, but his career went down in flames when he was caught using drugs.","그는 한때 최고의 운동선수였지만, 그의 경력은 그가 마약을 사용한 것이 들통나면서 모두 망했습니다."
The runner seemed to find his second wind as he reached the 15 km mark.,그 주자는 15km 지점에 도달했을 때 새로운 활력을 얻은 것처럼 보였습니다.
I wonder how my son had weathered the storm after lost his job.,저는 제 아들이 실직한 후 어떻게 고비를 이겨냈는지 궁금합니다.
"When Mary blamed the oven for burning the turkey on Thanksgiving, her husband jokingly replied, A bad workman always blames his tools.","메리가 추수감사절에 칠면조를 태우는 것에 대해 오븐을 탓하자, 그녀의 남편은 농담으로 서투른 목수가 항상 연장 탓한다고 대답했습니다"
"Despite the tough competition, they're determined to make a go of their new bakery.","경쟁이 치열함에도 불구하고, 그들은 새 빵집을 성공시키기로 결심했습니다."
Hang in there,참고 버티어라.
You have a snowball's chance in hell of winning the lottery.,복권이 당첨되는 것은 하늘의 별 따기다.
He made a killing by investing in cryptocurrency before it surged in value.,그는 암호화폐가 가치가 급등하기 전에 암호화폐에 투자하면서 한 번에 큰 돈을 벌었습니다.
The potential of the electric vehicle market has also encouraged traditional carmakers to jump on the bandwagon.,전기 자동차 시장의 잠재력은 또한 전통적인 자동차 회사들이 시류에 편승하도록 장려했습니다.
I thought I'd better strike while the iron was hot. ,나는 이 찬스를 놓쳐서는 안 된다고 생각한 것이다.
I can't take time on your problem because I have other fish to fry.,더 중요한 일이 있어서 당신에게만 매달려 있을 순 없어.
"During the current pandemic, everyone was riding out the storm until they found a vaccine.","현재의 대유행 기간 동안, 모든 사람들은 백신을 찾을 때까지 이 고비를 이겨내고 있었습니다."
He has been building houses for many years and has a lot of know-how.,그는 여러 해 동안 집을 짓고 있고 많은 노하우를 가지고 있습니다.
They gave him the ax.,그들은 그를 해고했다.
Our plans are perfect. Don't discuss them with anyone. We don't want to upset the applecart.,우리 계획은 완벽해. 아무에게도 이야기하지 마. 우리는 상황을 어지럽히고 싶지 않아.
"Since business has improved, he is really raking it in.",비즈니스가 개선되어서 그는 정말 돈을 벌고 있어요.
A lot of companies are finding ways to cut corners lately.,많은 회사들이 일반 절차와 다르지만 비용 절감할 방법들을 찾고 있다.
We need to buy a lot of stuff for the party.,우리는 파티를 위해 많은 물건을 사야 합니다.
"I wanted to paint the room blue, my wife wanted yellow. I had to give in.","나는 방을 파란색으로 칠하고 싶었지만, 아내는 노란색을 원했어. 나는 어쩔 수 없이 양보했어."
An apple a day keeps the doctor away.,하루 사과 한 알이면 의사가 필요 없다.
"do whatever you can, but don't bite off more than you can chew.",할 수 있는 만큼 하되 능력 이상으로 무리하지마.
I feel snowed under with all the work my boss keeps throwing my way.,상사가 자꾸 일을 줘서 할 일이 산더미야.
It takes one to know one. ,사돈 남 말 한다.
"I thought my idea was great, but my boss said it would never work. He shot it full of holes.",내 아이디어가 좋다고 생각했지만 상사는 그것이 절대로 동작하지 않을 것이라고 말했어요. 그는 큰 흠을 찾았어요.
This bed offers the best of both worlds for those seeking comfortable and cozy.,이 침대는 편안함과 안락함을 모두 원하는 사람들에게 일석이조의 효과를 제공합니다.
Moving from my old school to this one is like jumping out of the frying pan into the fire.,제가 다니던 학교에서 이곳으로 이사하는 것은 마치 여우를 피하려니 호랑이를 만난 격과 같습니다.
She's ready to leave at the drop of a hat. ,그녀는 즉시 떠날 준비가 되어 있다.
"To make matters worse, free school meals have been withdrawn.",설상가상으로 무료 학급 급식이 취소돼 버렸다.
He was upset and crying so hard that he couldn't snap out of it.,"그는 패닉, 두려움, 히스테리아의 통제에서 벗어날 수 없어서 울고 있었습니다."
"Jonh cheated on her, Add insult to injury, it was with her best friend.","존이 바람을 피웠는데, 설상가상으로 바람난 상대가 그녀의 절친이였어."
I had to stay at work late yesterday. Some new work cropped up.,어제 늦게까지 회사에 남아있어야 했어요. 새로운 일이 생겼어요.
I’ll see if I can pull strings so that you can get an interview.,당신이 면접을 볼 수 있도록 제가 비밀리에 영향력을 행사할 수 있는지 알아보겠습니다.
Sweet after bitter.,고진감래
I told her that she was the apple of my eye.,내게 있어 가장 소중한 사람은 그녀라고 직접 말했어.
He obviously felt that he had bigger fish to fry.,그는 자기가 코가 석자라고 확실하게 느꼈어요.
About to hit the sack. Sweet dreams everybody. ,자려는 참이야. 모두들 좋은 꿈 꿔.
It's time for you to spill the beans about him.,이제 그에 대한 비밀을 말할 때야.
"My team has several new trainees and we now have a new project to manage. Oh boy! When it rains, it really does pour!",저희 팀에는 몇 명의 신입 연수생이 있고 이제 관리해야 할 새로운 프로젝트가 있습니다. 오 이런! 좋은 일이든 나쁜 일이든 한 꺼번에 일어납니다!
This mistake would never happen if you were on the ball.,당신이 유능했더라면 이 실수는 절대 안 일어났을 거예요.
do nnot miss the boat.,기회를 놓치지 마라.
The court's decision gave us some breathing room.,법원의 결정은 우리에게 숨통을 틔워주었습니다.
I know! Time flies when you're having fun.,그러니까. 재미있을 떄는 시간이 너무 빨리 가.
It's a piece of cake compared to my job this morning.,오전에 내가 한 일에 비하면 이건 식은 죽 먹기 수준 이야.
I won't worry about what other people are saying about me. I have bigger fish to fry.,나는 다른 사람들이 나에 대해서 뭐라고 말하는지 걱정하지 않아. 내 코가 석자라.
"My credit card is declined at lunch and to add insult to injury, my ex-boyfriend was at the next table!","점심때 신용카드 결제가 거절 됐는데, 설상가상으로 전 남자친구가 옆 테이블에 있었어!"
The police were asking him about the robbery. He knew he had to tell everything he knew and let the chips fall as they may.,경찰은 그에게 강도 사건에 대해 묻고 있었습니다. 그는 자신이 알고 있는 모든 것을 말하고 결과에 상관없이 행동해야 한다는 것을 알고 있었습니다.
Everybody in this compay will support you if you decide to move to another company but the ball is in your court if you decide to change your mind at the last minute.,"당신이 다른 회사로 옮기기로 결정한다면 이 회사의 모든 사람들이 당신을 도울 거지만, 마지막에 마음을 바꿀지 말지는 결정하는 것은 당신의 몫입니다."
"I need a 2-inch screw that will hold a part tight in the light fixture. I've been scrounging around for an hour, but can't seem to find one.",조명기구에 부품을 단단히 고정할 수 있는 2인치 나사가 필요합니다. 한 시간 동안 이리저리 돌아다녔는데 못 찾겠어요.
"If you don't get along, keep your distance but never burn bridges.",잘 지내지 못한다면 거리를 유지하되 관계를 망치지 마세요.
You are playing with fire if you drive with your car on 'empty'.,차가 '연료부족' 상태로 운전한다면 위험을 불러일으키는 겁니다.
Slow and steady wins the race. is a dictum which emphasizes steadiness.,천천히 그리고 꾸준히 하면 경주에서 이긴다.라는 끈기를 강조하는 격언이다.
"Herbert came off it, said he was the only one who could do the job. I told him to come off it.",허버트는 그 일을 할 수 있는 사람은 자기밖에 없다고 했어요. 저는 그에게 그 일을 그만두라고 말했습니다.
It's not over till the fat lady sings.,끝날때까지 끝난게 아니다.
Absolutely. Slow and stead wins the race.,급하게 먹은 밥은 체하지.
I'm broke. I should find ways to cut corners.,나 돈을 다 썼어. 돈을 아낄 방법을 찾아야 겠어.
Don't put all your eggs in one basket.,한가지 일에 모든 걸 걸지 마라.
"It's about time, but better late than never.","이제야 하는군요, 하기야 늦더라도 아예 안 하는 것보다야 낫겠지요."
I'm feeling under the weather.,몸이 좀 안 좋은 것 같아.
"ladies, stop it. you have been friends for 20 years. what on earth has gotten into you all?","여성분들, 잠깐만요. 20년지기 친구 아닌가요. 세상에 당신들 사이에 무슨일이 있었던 거에요?​"
I feel better ever since I told him my problem and got it off my chest.,나는 그에게 내 문제를 얘기한 후로 기분이 좋아져요. 가슴을 털고 나왔기 때문이죠.
Every cloud has a silver lining.,하늘이 무너져도 솟아날 구멍이 있다.
The hem on the dress ripped. I doctored it up with some tape.,드레스의 밑단이 찢어졌어요 테이프를 붙여 손댔어요.
"With so many brothers competing for the car, I learned that the early bird gets the worm.","그 차를 차지하려고 다투는 많은 형제들 틈에서, 전 일찍 일어나는 새가 벌레를 잡는다는 사실을 배웠습니다."
His boss found out he has been stealing from the cash register. He’s a goner.,그의 상사는 그가 금전 등록기에서 훔치고 있다는 것을 알게 되었습니다. 그는 문제가 생겼어요.
Don't cry over Jane. There are plenty more fish in the sea!,제인 때문에 울지 마. 세상에 널린게 여자야!
Have you dug up any information on the new employee?,신입사원에 대한 정보는 찾아냈습니까?
I hated greasy spoon dinner last night.,난 어젯 밤에 먹었던 값싼 식사를 싫어했다.
"Some people think that he's already lost the election, but it ain't over till the fat lady sings, you know!","사람들은 이미 그가 선거에서 졌다고 말하지만, 결과는 끝까지 가봐야 아는 거라고!"
"He didn't put all his eggs in one basket, so he was able to recover from his losses.","그는 한 가지에 모든 걸 투자 하지 않았기 때문에, 그래서 손실에서 회복 할 수 있었어."
She used to rub it in that I was fired from my job. She is no longer my friend.,그녀는 제가 직장에서 해고되었다는 사실을 입에 올리기도 했습니다. 그녀는 더 이상 제 친구가 아닙니다.
I was put on the spot and expected to make a toast at the anniversary party.,"저는 어려운 상황에 처했고, 기념일 파티에서 건배사를 할 것으로 예상했습니다."
"To make a long story short, you have to work out every day.","간단히 말해서, 너는 매일 운동을 해야해."
The company can't expect me to move my home and family at the drop of a hat.,내가 즉각 내 집과 가족을 옮겨갈 거라고 회사가 바랄 수는 없어요.
Let’s put our heads together and figure out a way to solve this problem.,문제를 해결하기 위해 머리를 맞대고 생각해 봅시다.
I can come at the drop of a hat.,나는 즉시 갈 수 있으니까.
"Milton Friedman, praised as the most influential economist of the 20th century and a recipient of Nobel Memorial Prize in Economics, used to say There's no such thing as a free lunch, which means there is nothing for free. ",20세기의 가장 영향력 있는 경제학자로 추앙 받으며 노벨 경제학상 수상자인 밀턴 프리드만은 공짜는 없다는 뜻인 공짜 점심이라는 것은 없다는 말을 하곤 하였다.
There's no use trying to keep this business going. We are flogging a dead horse.,이 사업을 계속하려고 노력해도 소용이 없습니다. 우리는 헛수고를 하고 있습니다.
The sports club went down in flames after the players and fans joined in protest against the corrupt management.,선수들과 팬들이 부패한 경영진에 항의하기 위해 합류한 후 스포츠 클럽은 실패했습니다.
As a woman? I am not gonna put in a sentence as a woman. I'm not putting my egges in that basket.,여성으로서? 난 절대 그런 말 안 뱉을 거예요. 그런 위험 부담은 절대 안 합니다.
He realized that he was able to get along quite well without his partner.,그는 동료 없이도 꽤 잘 지낼 수 있다는 것을 깨달았어.
Everyone told me this idea was stupid. I didn't listen to them and stuck to my guns.,"모두 나에게 이 아이디어가 어리석다고 말했지만, 나는 그들의 말을 듣지 않고 내 주장을 고수했습니다."
"When you see their new home, you’ll know that they live high off the hog.",그들의 새 집을 보면 그들이 호화롭게 살고 있다는 것을 알 수 있을 것입니다.
"Even though we have to fly to get to your wedding, we will be there by hook or by crook.","비록 우리가 당신의 결혼식에 가기 위해 비행기를 타고 가야 하지만, 우리는 수단과 방법을 가리지 않고 갈 것입니다."
You said a mouthful when you admitted that she was the smartest girl in her class.,그녀가 그녀의 반에서 가장 똑똑한 소녀라고 인정했을 때 당신은 진실한 말을 했습니다.
"You said that you would help pay for their wedding. Well, it's been three months. cough it up.","두 사람의 결혼식 비용을 내겠다고 하셨잖아요. 글쎄요, 벌써 3개월이나 지났는데요. 토해내세요."
"I was going to stop working at 6:00 pm, but I got my second wind and just carried on until about 9:00 pm.","저는 오후 6시에 일을 그만 두려고 했지만, 새로운 활력을 얻어서 오후 9시쯤까지 계속했습니다."
"Ever since she won the lottery, she has it made.",그녀가 복권에 당첨된 이후로 그녀는 성공을 확신했습니다.
It'll be a piece of cake for him.,그에게는 식은 죽 먹기지.
"My neighbor had applied for the post of architect in a big project, but did not cut the mustard.","제 이웃은 큰 프로젝트에서 건축가 자리에 지원했지만, 기대에 부응하지는 못했습니다."
