en,ko
"He seems confident, but the devil is in the details. He may have missed something important. ","그는 자신감에 찬 듯 보이지만, 세부사항에 문제가 있을지도 몰라 중요한 부분을 놓친 게 아닐까."
His boss found out he has been stealing from the cash register. He's a goner.,그의 상사는 그가 금전 등록기에서 훔치고 있다는 것을 알게 되었습니다. 그는 문제가 생겼어요.
"After reports of another attack, the ongoing peace talks are sure to go down in flames.","또 다른 공격에 대한 보도가 있은 후, 현재 진행 중인 평화 회담은 분명 실패 할 것입니다."
She's been down in the dumps ever since she lost her job.,그녀는 직장을 잃은 후 줄곧 우울해 하고 있습니다.
He is playing up to his boss because he is hoping to move up in the company.,그는 승진하려고 회사에서 아부하고 있어.
Once in a blue moon,가뭄에 콩 나듯
He felt as right as rain after his brain surgery.,그는 뇌수술 이후에 아주 건강한 느낌이 들었다.​
"The other teachers are cutting Rakeem some slack, but Gabe here is not havig him to a damn thinng. Gibe that man a rasie!","다른 선생등은 라킴을 봐주는데, 게이브는 라킴한테 아예 아무것도 안 시켜요. 게이브 월급 올려줘요!"
"If I had worked on the project on time, everything would have been right as rain.",프로젝트를 제시간에 작업했다면 모든 것이 순조로웠을 것입니다.
I am an amateur sleuth with limited selfcontrol and a computer. It was a perfect storm.,자제력이 부족한 아마추어 탐정 손에 노트북을 쥐여주면 이렇게 최악의 상황이 된다.
"Since the 1960s, researchers have studied whether opposites attract or birds of a feather flock together.","1960년대부터, 연구원들은 상반된 것들이 서로 끌어당기는지 아니면 유유상종인지를 연구해왔습니다."
He told me that he got all A's in college. I don't believe him. You should take it with a grain of salt.,대학에서 A 학점을 다 받았다고 그러더라고요. 저는 그 사람 말을 못 믿겠어요. 넌 그 말을 회의적으로 받아들여야해.
He knew that when he was caught in a lie his goose was cooked.,그는 거짓말이 들킬 경우 큰 문제가 될 것을 알고 있었어.
I'm all about trying new foods.,맛집 탐방하는 거 너무 좋아.
Let us hope the pandemic disappears. It came as a bolt from the blue in 2020.,전염병이 사라지기를 바랍니다. 2020년에 청천벽력처럼 왔습니다.
The police said they would leave no stone unturned in their search for the stolen jewellery.,경찰은 도난당한 보석을 찾기 위해 수단과 방법을 가리지 않을 것이라고 말했습니다.
I don't want to rely on just one source of income. It is important not to put all your eggs in one basket.,나는 하나의 소득원에만 의존하고 싶지 않아. 한 방에 모든 것을 걸면 안 되는 거 알지?
Give someone the cold shoulder,냉대하다.
It is a half-baked idea.,어설픈 생각입니다.
After forty years in politics I think it's time for me to call it a day.,내가 정계에서 40년을 보냈으니 이제 그만할 때도 되었다고 생각한다.
How was the test? wasn't it a piece of cake?,시험 어땠어? 누워서 떡먹기 아녔어?
Let me point out the problem with your plan.,당신의 계획에 문제점을 지적할게요.
The results of the examination have yet to be made. Don't count your chickens,합격자 발표가 아직 안 났으니 김칫국부터 마시지 마라
"Instead of sitting on the fence, why don't you list out the pros and cons so that you can reach a decision.","좌시하지 말고, 여러분이 결정을 내릴 수 있도록 장단점을 나열해 보는 것은 어떨까요."
Check the coast is clear before you leave the room.,방 나가기 전에 이상 없는지 확인해.
"I'm gonna have to take a rain check this time, I think",이번에는 다음 기회로 미뤄야 할 것 같아요.
"The skiing conditions won't be this good for another several months, so let's make hay while the sun shines.","앞으로 몇 달 동안은 스키 조건이 이렇게 좋지 않을 테니, 물 들어올때 저어 봅시다."
this opportunity just fell into my lap.,좋은 기회가 생겼어요. 호박이 넝쿨째 들어왔어요.
Hit the sack,잠자리에 들다
I felt like someone pulled the rug out from under me when he said he wouldn’t pay my tuition.,그가 내 수업료를 지불하지 않을 거라고 말한 순간 나는 갑자기 무너졌어.
That's the last straw,더 이상 참을 수 없습니다.
"I would like to lend you money, but we just bought a car and a house. My hands are tied.","너한테 돈을 빌려주고 싶지만, 우리는 방금 차와 집을 샀어. 어쩔 수가 없군요."
"Although the project is massive, we managed to make a dent in it by completing the first phase.","비록 프로젝트가 방대하지만, 1단계를 완료함으로써 그럭저럭 진전을 이루었습니다."
The shopping mall was mobbed with customers the day before Christmas.,크리스마스 전날 쇼핑몰은 고객으로 북적였습니다.
You don't have to upset by breaking up with her. There are plenty more fish in the sea.,여자 친구와 헤어졌다고 낙심할 필요 없어. 앞으로 다른 사람 만날 기회 많아.
She thanked me from the bottom of her heart.,그녀는 마음 한가득 감사의 말을 했다.
I got deeply in debt. Then I really got out of the frying pan into the fire when I lost my job. ,"나는 빚에 쪼들리고, 게다가 실업자가 되었다. 바로 엎친 데 덮친 격이 된 것이다."
"Although I was bedridden for almost a week, I am now fit as a fiddle. ","거의 일주일간 침대에 누워 있었지만, 지금은 매우 건강합니다."
That woman is 50 years old but she is running like a 20 year old! She is as fit as a fiddle.,저 여자는 50살이지만 20살처럼 달리고 있어요! 그녀는 아주 건강합니다.
She's got a mind of her own.,그녀는 자기만의 생각을 가지고 있습니다.
"He boasted about her pumpkin pie, but I thought it was not so hot.","그는 그녀의 호박파이에 대해 자랑했지만, 나는 그것이 매우 좋지 않다고 생각했습니다."
"The government's new policy promises free healthcare to everyone, but we all know there's no such thing as a free lunch. Texpayers will foot the bill.",정부의 새 정책은 모두에게 무료 건강보험을 약속하지만 우리 모두 공짜는 없다는 걸 안다. 세금 납부자들은 그 비용을 치를 테니까.
"Because this was his first criminal offense, he was let off the hook.","이것이 그의 첫 번째 범죄였기 때문에, 그는 처벌을 면할 수 있었습니다."
I was floored when I found out they had made me a surprise birthday party.,나는 생일 파티를 위해 나에게 비밀 파티를 준 것을 알게 되었을 때 정말 깜짝 놀랐어.
"you just call your family, tell them I said 'hi', don't worry about being back at 6:00 on the dot, there's a little breathing room","너희 가족들한테 전화해서, 내가 안부를 전해줘, 6시 정각까지 맞춰서 돌아올 걱정은 하지마, 약간의 여유는 있으니깐"
It's raining cats and dogs outside. ,밖은 비가 엄청나게 내리고 있습니다.
"It looks like our company will perform well, but the devil is in the detail, who knows what the future will bring.","우리 회사가 실적이 좋을 것 같지만, 사소한 것이 문제를 일으킬 수도 있기에 미래가 어떨지 누가 알겠습니까."
"She's always talking about how much she is investing in the stock market, but I think she is talking through her hat.","그녀는 항상 주식시장에 얼마나 투자하고 있는지에 대해 이야기하지만, 저는 그녀가 자신의 생각을 과장해서 말하고 있다고 생각합니다."
"By accepting two part-time jobs, she is clearly biting off more than she can chew.","두 개의 아르바이트를 받아들이며, 그녀는 명확히 그녀 능력 밖의 일을 하고 있다. "
"When Mary saw John with another woman, Mary went on the warpath.",메리는 존이 다른 여자와 있는 것을 보고 매우 화가 났습니다.
"I thought your mom hated that candidate. Well, he's the president now, so she decided to jump on the bandwagon.","저는 당신 어머니가 그 후보자를 싫어하는 줄 알았어요. 글쎄요, 그 분이 지금 대통령이라서 우세한 편에 서기로 결정했어요."
I don’t think he’ll shoot. I think he’s just bluffing.,그가 총을 쏘지는 않을 거야. 그냥 허세를 부리는 거라고 봐.
It's good that you're organizing but don't bite off more than you can chew. Ask other friends to help you organize it too.,"정리하는 것은 좋지만, 너무 많이 무리 하지 마세요. 다른 친구들에게도 정리하는 것을 도와달라고 요청하세요."
"Before anything else happened, right off the bat, he welcomed everyone to the meeting.","무슨 일이 벌어지기 전에, 그는 바로 회의에 참석한 모든 사람을 환영했어요."
She found out a secret and told all of her friends. She spilled the beans.,그녀는 비밀을 알아내고 친구들에게 모두 말했어요. 그녀는 비밀을 말했어요.
"The player who replaced our star player is amazing, so I guess every cloud has a silver lining!","우리의 스타 선수를 대체한 선수가 놀랍기 때문에, 좋은 점도 있는 것 같아!"
what brings you here?,무슨 일로 오셨어요?
I get a kick out of it every time I see her dance.,나는 그녀가 춤을 추는 것을 볼 때마다 정말로 즐겨요.
She felt like a fish out of water when she went to the party in her formal dress while everyone else was wearing jeans.,그녀는 모두가 청바지를 입고 있는 동안 정장 차림으로 파티에 갔을 때 어색해서 혼났다.
"I’m worried about next week’s test, but I am going to relax and put it out of my mind.","다음 주 시험이 걱정이지만, 마음을 편안하게 하고 잊어버릴 생각입니다."
i'm on cloud nine.,저는 너무 행복해요.
He asked about the weather out from left field.,그는 갑자기 날씨에 대해 물어봤다.
What is the best way to break the ice?,어색함을 푸는 가장 좋은 방법이 뭐야?
What you heard is true. I know since I heard it straight from the horse's mouth.,네가 들은 것은 사실이야. 나는 그걸 직접 당사자의 말에서 들었기 때문에 알고 있다.
"I saw Jim was complanining about her tardiness in front of people. I know I shouldn't do this but, I would say now he got a taste of his own medicine.",난 짐이 사람들 앞에서 그녀의 지각에 대해 불평하고 있는 것을 봤어. 이러면 안 되는 거 알지만 이제 그도 똑같이 되돌려 받는 거라고 말하고 싶네.
"You're not understanding this, Dennis, but I think I have something that could help you wrap your head around it.",이해를 못 하고 있는 거 같은데 네가 이해하는 데 도움이 될 만한 게 있어.
Stock markets have been going suth after the chairman of the Federal Reserve said the central bank would continue raisinng interest rates.,연방준비제도의 의장께서 중앙 은행이 금리 인상을 계속 할 것 이라고 말을 한 후에 주식 시장이 나빠지고 있다.
It bugs me every time he asks to borrow a pencil.,그가 매번 연필을 빌려달라고 할 때마다 짜증납니다.
"I didn’t have time to read once-over the contract, so I gave it a once-over.",시간이 없어서 계약서를 한 번 훑어보기만 했어요.
They promised that they will leave no stone unturned to find the solution to the problem.,그들은 그 문제의 해결책을 찾기 위해 수단과 방법을 가리지 않겠다고 약속했습니다.
I was just playing devil's advocate.,난 그저 악마의 대변인 흉내낸 거야.
My girlfriend told me she wanted to take a break from our relationship.,여자친구가 나한테 우리 생각할 시간을 좀 가지자고 말했어.
Are you coming for a drink? Can I take a rain check? I must get this finished tonight.,한 잔 하러 오시겠어요? 다음을 기약해도 될까요? 오늘 밤에 이 일을 끝마쳐야 해서요.
"If you are really serious about buying my car, let's talk turkey.","정말로 내 차를 사는 것이 진심이라면, 진지하게 얘기 해봅시다."
He was carried away by his effective sales approach and bought the remainder of his products.,그는 자신의 효과적인 영업 방식에 사로잡혀 나머지 제품들을 구입했습니다.
My mother has never let me off the hook for breaking her favorite lamp as a kid.,엄마는 내가 어렸을 때 엄마가 가장 아끼는 램프를 깨뜨린 것을 눈 감아주지 않으신다.
The team was bawled out after they lost the game.,그 팀은 경기에서 진 후 질책을 받았습니다.
"She didn’t know what was causing the problem, but she finally put her finger on it.","그녀는 무엇이 문제를 일으키는지 모르았지만, 마침내 정확한 원인을 찾았어요."
He doesn't have a snowball's chance in hell of getting the job.,그가 직업을 다시 구할 가망이 없어.
"Well, what if she won't tell me? you can cross that bridge.",말 안 해 주면? 그때 가서 고민해.
He missed the boat by not investing in the booming tech industry when it was still in its infancy.,그는 아직 초기 단계에 있을 때 호황을 누리고 있는 기술 산업에 투자하지 않음으로써 그 기회를 놓쳤습니다.
"The boss's son doesn't believe his father should pay anyone overtime, but when he can work extra hours, he whistles a different tune.","사장의 아들은 누구에게도 야근 수당을 주지 말아야 한다고 생각하지만, 그가 추가 근무 할 수 있는 경우에는 다른 얘기를 해."
Every cloud has a silver lining. There's always light at the end of the tunnel.,나쁜 일에도 좋은 면은 있어요. 터널 끝에는 항상 밝은 빛이 있는 법이에요.
This whole complicated situation just boils down to something simple. It’s either a yes or a no.,"이 모든 복잡한 상황은 단순한 것으로 귀결됩니다 예, 아니오 둘 중 하나입니다."
They needed to break up their engagement because she fell in love with someone else.,그녀가 다른 사람과 사랑에 빠졌기 때문에 그들은 약혼을 깨야 했습니다.
What do you make of his decision to drop out of college?,그가 대학을 중퇴하기로 한 결정에 대해 어떻게 생각하십니까?
"When you ride in a car, buckle your seat belt. An ounce of prevention is worth a pound of cure.",차를 탈 때는 안전띠를 매세요. 유비무환입니다.
"When she embarrassed me in front of my friends, I angrily answered her back and put her in her place.","그녀가 내 친구들 앞에서 나를 당황하게 했을 때, 나는 화가 나서 그녀의 자리에 그녀를 앉혔다."
Please cover me if I end up not knowing what to say at the meeting.,회의에서 제가 무슨 말을 해야 할지 모르겠으면 제발 도와 주세요.
"I should go home, now because I have bigger fish to fry.",나는 더 중요한 일이 있어서 집에 가봐야 할 것 같아.
I wouldn't go out right now. It's raining cats and dogs. ,지금 밖에 나가지 않을거야. 비가 엄청 많이 오거든.
Don't be late again! Don't you know that the early bird gets the worm?,두 번 다시 지각하지 마라. 일찍 일어나는 새가 벌레를 잡는다는 말도 모르는가?
She ordered some brandy as a nightcap.,그녀는 떠나기 전 마지막으로 브랜디를 주문했습니다.
The new teacher doesn't seem to know what he's teaching. He's not playing with a full deck.,새 선생님은 자신이 무엇을 가르치는지 모르는 것 같습니다. 그는 비정삭적입니다.
What if he denies it? then we will cross that bridge.,만약 그자가 부인하면? 그러면 싸워야지.
I am a little under the weather. I feel a bit light-headed. But I'm trying to power through ​ for that meeting later. ,"나 약간 몸이 안좋아. 약간 어지러운거 같아. 그렇지만, 나중에 있을 미팅은 어떻게든 참석할거야."
"You need to check these files carefully. Do not try to finish them too quickly – remember, haste makes waste.",당신은 이 파일들을 주의 깊게 확인해야 합니다. 너무 빨리 끝내려고 하지 마세요. 서두르면 일을 그르치게 된다는 것을 기억하세요.
It never rains it only pours.,불운은 한꺼번에 닥친다.
"The team had partied late into the night, but on match day, each of them was as fit as a fiddle.","그 팀은 밤늦게까지 파티를 했지만, 경기 당일에는 그들 각자가 아주 건강했습니다."
Some babies yell bloody murder if their mothers leave them with babysitters.,어떤 아기들은 엄마가 아기를 유모에게 맡긴다면 화들짝대며 소리 지릅니다.
The recipe needs a little help. I think salt may do the trick.,이 요리법은 약간의 도움이 필요해요. 소금이 효과가 있을 것 같아요.
The plan to surprise my boss went haywire.,"계획은 상사 생일을 축하하려고 준비됐지만, 모든 게 망가졌어요."
Clothes were scattered around the messy room.,방에서는 옷들이 흩어져 있었어요.
"Listen, Frank, all I'm asking is that you play devil's advocate.","프랭크, 그냥 오셔서 반대 의견만 말하시면 돼요."
let yourself off the hook.,자신을 좀 봐줘요.
"They say ignorance is bliss, but it's downright frustrating for me.",그들은 무지가 축복이라고 말하지만 나에게는 완전히 짜증나는 것이다.
"His son watched TV all day and didn’t work. When he started to gamble, that was the last straw.",그의 아들은 하루 종일 TV를 보고 일을 하지 않았습니다. 그가 도박을 시작했을 때 그것은 마지막 고비였습니다.
"Even though she is the only one who knows how to fix all of the computers, she doesn't realize how valuable she really is. She is always selling herself short.","그녀는 컴퓨터를 다 고칠 줄 아는 유일한 사람이지만, 자신이 얼마나 가치 있는 사람인지 알지 못합니다. 그녀는 항상 자신을 과소평가합니다."
Better late than never,늦더라도 안 하느니보다는 낫다
I thought the salesman was obnoxious. He left a bad taste in my mouth.,저는 그 판매원이 불쾌하다고 생각했어요. 인상이 좋지 않았어요.
Kill two birds with one stone,일석이조
Sitting in traffic for 5 hours really got my goat.,5시간 동안 교통체증에 갇혀 앉아 있으면 짜증이 났다.
You've hit the nail on the head. That's exactly what I want.,맞아서 바로 그거야. 그게 바로 내가 원하는 거야.
I'll cook at home rather than eating outside because a penny saved is a penny earned.,"밖에서 사먹기 보다는 집에서 요리할래, 티끌모아 태산이지."
A lot of people ended up losing money when the economy went south.,많은 사람들이 경제가 악화되었을 때 결국 손해를 보게 되었습니다.
"Yes, because all the cops seem to be doing is going on a wild goose chase.","그래, 경찰이 하는 일 이라고는 허탕 치는 거니까."
A penny for your thoughts?,무슨 생각해?
"When he started asking too many questions of his neighbours about their whereabouts during the weekend, they warned him that curiosity killed the cat.","그가 주말 동안 그의 이웃들에게 그들의 행방에 대해 너무 많은 질문을 하기 시작했을 때, 그들은 호기심이 지나치면 위험할 수가 있다고 그에게 경고했습니다."
Don't get bent out of shape about it.,그런 일로 화내지마.
"Okay, I’m game.","좋아, 나도 찬성이다."
My fiancée is friendly and sensible. She's very down to earth.,제 약혼녀는 친절하고 분별력이 있어요. 그녀는 아주 현실적이에요.
You can't judge a book by its cover.,겉보기로 판단해서는 안 된다.
Sorry to hear you're under the weather,몸이 안 좋다니 유감이야.
He never has his own opinion. He is very wishy-washy.,그는 항상 자신의 의견을 가지지 않아. 그는 확고하지 않은 사람이에요.
Of course! I can beat you. It's a piece of cake!,당연하지! 나는 너를 이길 수 있어. 식은 죽 먹기라고!
It is a wild goose chase to do it without a plan.,"계획이 없다면, 그건 헛수고 하는 거에요."
There is no point crying over split milk.,소 잃고 외양간 고치는 격이야.
The move plan was put on ice because of the economic situation.,경제 상황 때문에 이사 계획은 보류 됐어.
"Since he was given a promotion, he’s been acting like a big shot.",승진한 이후로 중요한 사람처럼 행동하고 있습니다.
"You've arrived late several times, and today is the last straw.","이미 여러 번 늦으셨기 때문에, 오늘 일에 대해선 더 이상은 무리예요."
please don't get bent out of shape when you hear the bad news.,좋지 않은 소식을 듣고 화내지 않았으면 좋겠어.
You have to be on the ball.,정신 바짝 차리고 있어야 해.
After a storm comes a calm.,고생 끝에 낙이 온다.
"John said to his brother,  You better bring your car to the shop while it's still running, because a stitch in time saves nine.","존이 형에게 말했다, 차가 아직 움직일때, 정비소에 차 가져가 보는게 좋을 거야 왜냐면 지금의 수고가 나중에 더 큰 수고를 덜 수 있어. "
I think you're a bit off your rocker.,너 요즘 좀 이상해.
"She complained that she was passed over for promotion, but there's no point crying over split milk.","그녀가 승진 대상에서 제외 된 것으로 불만을 제기했지만, 이미 엎지러진 물이라서 소용 없었다."
I have the best of both worlds - a wonderful family and a great job.,나는 두가지 좋은 것을 다 가지고 있지 멋진 가족과 좋은 직업.
Time flies when you're having fun,재미있을 때는 시간 가는 줄 몰라.
This column does not add up. I will double-check it for a mistake.,이 열은 앞뒤가 맞지 않습니다. 실수가 없는지 다시 한번 확인해 보겠습니다.
An ounce of prevention is worth a pound of cure.,유비무환이다
"At the moment, he's been transferred to my team and I'm his supervisor. I'm going to give John a taste of his own medicine.","지금 이 순간, 그는 내 팀으로 발령 받았고, 나는 그의 관리자이다. 그에게 받은 대로 갚아 줄 것이다."
"The doctors say she no longer has the disease. Her prognosis is very good, and she is now out of the woods.",의사들은 그녀가 더 이상 이 병을 앓고 있지 않다고 말합니다. 그녀의 예후는 매우 좋으며 현재는 건강한 상태입니다.
"I never really considered myself smart based on traditional measures, but as Walter Isaacson said Smart people are a dime a dozen.","나는 전통적인 방법에 근거하여 나 자신을 똑똑하다고 생각한 적은 없지만, 윌터 아지가슨이 말했듯이 똑똑한 사람은 흔하다."
She shopped around for the perfect dress to wear to the party.,그녀는 파티에 입을 완벽한 드레스를 찾기 위해 쇼핑을 했습니다.
"She was given information which was meant to be private, so she kept it under her hat.",그녀는 주어진 정보를 비밀로 유지했습니다.
I have overheard that she may be fired from her job. I think she is a hard worker and I want her to stay. I'm going to bat for her.,그녀가 그녀의 직장에서 해고될 수 있을 것이라는 얘기를 들었어. 그녀는 열심히 일하는 것 같아서 그녀를 돕기 위해 노력하려고해.
"You guys are moving fast, but there's no way you're actually comprehending anything. I'am taking my time and reading deliberately, and you know what they say, slow annd stead sinns the race.",두사람을 빨리 읽네요. 하지만 분명히 하나도 이해 못 했을 거예요. 난 시간을 들여서 세밀히 읽죠. 이런 말 있죠? 끈기 있는자가 승리한다
My father always sided with my sister even though he knew she was wrong.,아버지는 언니가 틀렸다는 것을 알면서도 항상 언니 편을 들었습니다.
"After moving to a new school, I found a group of friends who share my love of eating and cooking foods. Birds of a feather definitely flock together.","새로운 학교로 전학 온 뒤로, 먹는 거 좋아하고 요리하는 것도 좋아하는 친구들을 찾았어. 역시 끼리끼리야."
I didn't know it would have a snowball effect.,나는 이것이 눈덩이 효과처럼 불어날지 몰랐어요.
It seems like all our moral standards have just goen south.,우리의 도덕적 기준이 나빠진 것 같아.
Having to clean out my basement is the pits.,내 지하실을 청소해야 하는 것은 골치 아픈 일입니다.
She bit off more than she could chew in our original plan.,그녀는 우리의 계획을 가지고 그녀 능력 밖의 일을 했다.
He got in on the ground floor.,그는 처음부터 참여하였다.
"Even though they work two jobs, it's still challenging to make ends meet with their high expenses.","두 가지 일을 하고 있지만, 여전히 높은 비용과 생계 유지 균형 잡기가 어렵습니다."
Newspaper advertising works well for us because we get the best bang for the buck.,신문 광고는 지출된 돈에 대한 가치를 얻기 때문에 우리에게 효과가 좋습니다.
"For the time being, let’s not make any changes to the report.","당분간, 보고서에는 어떤 변경도 하지 말자."
