en,ko
I don’t like it when she pushes me around.,나는 그녀가 나를 압박하는 걸 싫어해.
The doctor said he will leave no stone unturned to find a cure for his illness.,의사는 그가 그의 병의 치료법을 찾기 위해 수단과 방법을 가리지 않을 것이라고 말했습니다.
"Eventually, thinngs go south.",결국 어떤 것들은 하향하게 될거야.
She broke her neck last night trying to finalize the proposal.,그녀는 지난 밤에 제안서를 마무리하려고 무척 애를 썼답니다.
Jenny gave John the cold shoulder.,제니가 존을 차갑게 대했어.
Live and learn,오래 살고 볼 일이다
"If you want to play that game, you need a partner who will play with you. It takes two to tango.","만약 당신이 그 게임을 하고 싶다면, 당신은 당신과 함께 할 파트너가 필요합니다. 손뼉도 마주쳐야 소리가 납니다."
They need to hit the sack.,그 사람들 눈 좀 붙이게 해요.
A co-worker gave me a hand.,동료가 저를 도와줬습니다.
I'll kill two birds with one stone by doing them both in one trip to the bank.,은행은 한 번만 가면 되니까 일석이조다.
"The new employee just isn't curring the mustard, and I think we should get rid of him. ","그 신입 사원이 정말 기대에 못 미치고 있어요, 제 생각엔 그 지원 해고해야 할 것 같아요."
I don't want to put all my eggs in one basket and risk not getting accepted.,여러 대학교에 지원 할 거야. 한 한교에만 지원하면 떨어질 수도 있으니까
We had the meeting yesterday when you were out. Let me fill you in on what you missed.,어제 부재중일 때 회의를 했습니다. 빠진 부분에 대해서 말씀드리겠습니다.
It took me four hours to renew my driver's license. I was sent to almost every department and seemed to get the runaround.,"운전면허 갱신에 4시간이 걸렸어. 나는 거의 모든 부서로 보냈고, 마치 어디로 보낸 것처럼 느껴졌어."
I’m going to bat for her.,나는 그녀를 위해 싸울 거야.
I think we are going on a whild goose chase now.,내 생각엔 지금 우리 헛수고 하고 있어.
I wish she would get off my back.,그녀가 잔소리를 그만 했으면 좋겠다.
"She hates to be one for the books around children, and she’s an elementary school teacher. That’s one for the books.",그녀는 어린이들 사이에서 유명한 존재가 되는 걸 싫어해요. 그녀는 초등학교 선생님이에요. 그건 기록에 남을 만한 일이에요.
The theme for this year's party will not work. We need to think up a new idea.,올해 파티 주제가 안 될 것 같아요. 새로운 아이디어를 생각해 봐야 해요.
I don't think that man has washed his clothes in two weeks. He looks like a slob.,나는 그 남자가 두 주 동안 옷을 세탁하지 않은 것 같아. 그는 지저분해 보여요.
Has he decided which offer he is going to accept or is he still sitting on the fence?,"그는 어떤 제안을 받아들일 것인지 결정했나요, 아니면 아직 결정을 내리지 못한 상태인가요?"
A stitch in time saves nine stitches.,제 때의 한 바늘은 뒤의 아홉 바늘의 수고를 덜어준다.
"If you need help, just call on me. I can come at the drop of a hat.",자네가 내 도움이 필요할 때는 망설이지 말고 전화를 주게. 나는 즉시 갈 수 있으니까.
I had a fender bender on my way to work this morning.,오늘 아침 출근하는 길에 가벼운 사고가 있었어요.
I have completely recovered from my surgery and climb the stairs to my fifth floor apartment. I feel as fit as a fiddle.,저는 수술에서 완전히 회복되어 5층 아파트로 가는 계단을 올라갑니다. 몸이 아주 건강해요.
Don't have your head in the clouds about online services.,온라인 서비스에 대해 공상에 잠기지 마세요.
"When my car broke down for the third time, I realized that the car salesman really took me for a ride.","제 차가 세 번째로 고장이 났을 때, 저는 자동차 판매원이 정말로 저에게 사기를 치고 있다는 것을 깨달았습니다."
"I've told him numerous times to manage his routine effectively, but I think I've just been flogging a dead horse.","저는 그에게 그의 일상을 효과적으로 관리하라고 여러 번 말했지만, 저는 그냥 헛수고 하고 있었던 것 같습니다."
It was a close shave getting out of the burning building.,불타고 있는 건물에서 빠져나오는 것은 아슬아슬한 탈출이었습니다.
I got all shook up when I heard the awful news.,그 끔찍한 소식을 듣고 나는 몹시 놀랐습니다.
Live and learn,오래 살면 별일을 다 겪는다. 오래 살고 볼 일이다.
That was good for you annd forget about him. There are plenty of fish in the sea.,그를 잊는게 너에게 좋아. 세상에 기회는 얼마든지 있어.
"I am an export on this, so you should take it with a grain of salt.",난 전문가가 아니니까 감안하면서 들어.
"He did cause a lot of death, but he was like the perfect storm of issues that I think caused this man to become what he was.",많은 죽음의 원흉이긴 해도 그를 둘러싼 모든 문제가 그런 인물이 되도록 등을 떠밀었어요.
Kim does not like the logic and keeps her head in the clouds all the time.,김씨는 논리를 좋아하지 않아서 항상 딴 생각을 한다.
"We had troubles in our relationship before, but we always managed to weather the storm.","이전에 우리 관계에 문제가 있었지만, 우리는 항상 고비를 극복하려고 애썼다."
"To make a long story short, I'd like you to get over here right away.","한마디로 말하면, 네가 당장 여기로 왔으면 좋겠어."
Pull yourself together,힘을내요.
It may be an excellent time to jump on the bandwagon before the gold gets even more expensive.,금값이 더 비싸지기 전에 유행에 편승할 수 있는 절호의 시기일지도 모릅니다.
Everyone seemed very high-brow at the cocktail reception.,칵테일 리셉션에 참석한 모든 사람들이 매우 격식을 차린 듯 했습니다.
They laughm I laugh. It breaks the ice.,그들도 웃고 나도 웃어요. 그렇게 긴장이 풀리는 거죠.
I would not count your chickens before they have hatched.,나라면 김칫국 마시지 않을 것이다.
I can't just throw caution to the wind and eat everything anymore.,이제 더이상 앞 뒤 재지 않고 다 먹어 치울 순 없어.
She is not the type of person who throws cautions to the wind.,그녀는 앞뒤 가리지 않는 사람은 아니다.
"Last semester his grades were very low, so this year he decided to buckle down.","지난 학기에 그의 성적은 매우 낮았고, 그래서 올해 그는 열심히 공부하기로 결심했습니다."
I seem to have got off on the wrong foot with the new boss.,내가 새로 온 상사와 처음부터 관계가 꼬인 것 같다.
"That scientist is considered to be a genius in his field, but with some of the antics he's up to at the university, it looks like he's not playing with a full deck.",그 과학자는 그의 분야에서 천재로 여겨집니다. 하지만 그가 대학에서 익힌 익살스러운 행동들로 보아 그는 정상적인 사람이 아닌 것처럼 보입니다.
What? It isn't rocket science.,뭐? 무슨 엄청 어려운거 하는 줄 알겠어.
The lawyer was shrewd and made a monkey out of his opponent’s client.,그 변호사는 빈틈이 없어서 상대의 의뢰인을 이용해 수작을 부렸습니다.
I had so much to do that I was running around in circles.,나는 할 일이 많아서 무작정 돌아다녔어요.
He had butterflies in his stomach as he walked out onto the stage for his dance performance.,댄스 공연을 위해 무대로 걸어나올 때 그의 가슴이 두근거렸습니다.
I gave it my best shot.,나는 최선을 다했다.
"After talking to my friend for an hour, I finally got to the bottom of why he was angry at me.","친구와 한 시간 동안 이야기를 나눈 후에, 나는 그가 왜 나에게 화를 내는지 마침내 진상을 파악했습니다."
"When he realized that there was no way he was going to finish the race, he finally threw in the towel.","그는 경주를 끝낼 방법이 없다는 것을 깨달았을 때, 마침내 포기했습니다."
"Okay, you want to make plans to go to China? Okay, I'm game.","좋아요, 중국에 갈 계획을 세우고 싶어? 좋아요, 전 좋아요."
He sets an early curfew for his children. He draws the line at 10:00 PM.,그는 아이들을 위해 일찍 통금시간을 정해놓고 오후 10시에 선을 그었습니다.
He tried to egg on the citizen of the city. ,그는 그 도시의 시민을 선동하려고 했다.
She'll go bananas if she sees the house in this (dirty) condition.,이런 상태의 집을 보면 그녀는 미칠 것입니다.
You look tired. Drink this; it’s a good pick-me-up.,"피곤해 보여요. 이걸 마셔, 활력을 얻을 거에요."
It will add insult to injury if she ruins the dessert having already ruined the beef.,"걔가 이미 소고기 요리를 망쳐놨기 때문에, 걔가 디저트 까지 망치면 상황이 악화 될 거 같아."
"I hear you, but we'll cross that bridge when we get to it.","너의 심정은 이해 하지만, 그건 그때 가서 대처하자."
Are you alright? You don't seem on the ball today.,너 괜찮아? 오늘 좀 어딘가 멍해보이네.
The cost of fixing the sink is a drop in the bucket compared to replacing the whole sink.,싱크대 고치는 비용이 싱크대 전체를 교체하는 것에 비해 적은 금액입니다.
"I know you had a rough day, but you have to get that done today. So pull yourself together.",너 힘든 하루 보낸 거 아는데 너 이거 오늘까지 끝내야해. 그러니까 정신 좀 차려봐.
"I wasn't planning to spend the holidays with my family, but after speaking with my mother, I had a change of heart.",명절을 가족과 함께 보낼 생각은 없었는데 어머니와 이야기를 나누고 나니 마음이 바뀌었습니다.
We really can't compare the data any more. It's just apples and oranges.,우리는 그 자료를 더이상 비교 할 수 없다. 그 자료는 비교할 수 없다.
The whole deal was put on ice when the stock market fell.,주식 시장이 폭락하자 모든 거래가 지연되었다.
I know that they are getting married. I heard it straight from the horse's mouth.,나는 그들이 결혼한다는 것을 알고 있습니다. 나는 정확한 소식통으로 부터 직접 들었습니다.
"After 2 hours spending wandering, we realized we were on a wild goose chase.","두 시간 동안 방황한 후에, 우리가 부질 없는 짓을 하고 있다는 것을 깨달았어."
Let's not rain on his parade just yet. Allow him to feel happy for a little while. We'll break the bad news to him tomorrow.,아직은 초 지지 말자. 아들이 조금이라도 행복을 좀 느끼게 냅두자. 나쁜 소식은 내일 전해주자.
There's a way to kill two birds with one stone.,일석이조의 방법을 찾은거죠.
"Last year, everyone took a beating in the stock market.",작년에는 주식시장에서 모두들 타격을 입었습니다.
"Their son is named after his grandfather, who was a war hero.",그들의 아들은 전쟁 영웅이었던 할아버지의 이름을 따서 지어졌습니다.
I fixed her up with my best friend.,나는 그녀를 내 친한 친구랑 데이트 하도록 만들었다.
"If you like the activities and destination hopping, a cruise is the best of both worlds.","여러 가지 활동과 여기저기 옮겨 다니는 것을 좋아하시면, 유ㅠ랍선 여행이 일석이조 입니다."
It rains in the desert once in a blue moon.,사막에서는 비가 오는 일이 드물다.
"She was going to buy the last red dress that the store had, but I beat her to the punch and bought it first.","그녀는 상점에 마지막 빨간 드레스를 사려고 했지만, 내가 선수쳐서 먼저 샀습니다."
She was fed up with his attitude at the office.,그녀는 사무실에서 그의 태도에 진저리가 났습니다.
I was just going to say that he was a liar. You took the words right out of my mouth.,저는 그가 거짓말쟁이라고 말하려고 했습니다. 당신은 제가 하려고 했던 말을 하네요.
She is such a brain; she will figure out how to solve the problem.,"만약 당신의 수표가 받아들여지지 않는다면, 저는 당신에게 추가적인 돈을 청구해야 할 것입니다."
Out of the frying pan and into the fire,엎친 데 덮친 것 같아!
"Ji-hee, I hope you'll be able to have your cake and eat it.","우리 지희 씨, 앞으로도 두 마리 토끼를 다 잡을 수 있도록 응원하겠습니다."
Great. Becase a pretty big opportunity just fell in my lap.,좋아요. 생각지도 않게 좋은 기회가 생겼어요.
Her plans have gone up in smoke.,그녀의 계획은 허사로 돌아갔다.
"He may be an influential person, but some of the things he does gives the impression that he is not playing with a full deck.","그는 영향력 있는 사람일 수도 있지만, 그가 하는 일들 중 일부는 그가 비정삭적이라는 인상을 줍니다."
The air fryer isn't just a fad. Just climb on the bandwagon and get one for healthy cooking.,에어프라이어는 단순한 유행이 아닙니다. 유행에 편승하여 건강한 요리를 위해 하나를 얻으십시오.
That racket company is running a racket.,그 무리 회사는 불법 활동을 하고 있어요.
"He acts just like his father. You know, the apple doesn’t fall far from the tree.",아빠처럼 행동하는 거죠 부모나 가족처럼 행동하는 거 말이에요.
He is really gung ho this season.,그는 이번 시즌 정말 열정적이다.
He poured it on thick to his boss because he wanted to get a raise.,그는 승진을 원하기 때문에 상사에게 아첨하고 있어요.
All he ever thinks one-track mind about is football. He has a one-tracked mind.,그가 생각하는 것은 늘 축구뿐이에요. 그는 한 가지에만 집중하는 경향이 있어.
I was so mad at my cousin that I gave her the cold shoulder at the wedding reception.,나는 사촌에게 너무 화가 나서 결혼 피로연에서 그녀를 냉대했습니다.
They've been saving a nest egg for years to retire comfortably.,그들은 편안하게 은퇴하기 위해 몇 년 동안 저축해 왔습니다.
DARREN FERGUSON is starting to show he's a chip off the old block.,대런 퍼거슨은 그가 아버지를 쏙 빼닮았다는 것을 보여주기 시작합니다.
I don't want the hassle of picking you up from the party.,파티에서 당신을 데리러 오는 번거로움을 원하지 않습니다.
You have a good head on your shoulders; you'll do fine in college.,"너는 머리가 좋구나, 대학에서 잘 할 수 있을 겁니다."
Stop whinning and pull yourself together.,그만 징징 거리고 정신 좀 차려.
The new intern is totally on the ball.,새로 온 인턴은 완전 똑부러져.
"When things went south with my husband, I sold all my Birkins.","남편이 상황이 나빠졌을 때, 내 에르메스 버킨 백 다 팔았어."
Judy doesn't like to make plans. She prefer play it by ear.,주디는 계획 세우는 걸 싫어해. 즉흥적으로 결정하는 것을 선호하지.
"She told him why she wouldn’t date him anymore, and she didn’t pull any punches.",그녀는 왜 그와 더 이상 데이트를 하지 않을 것인지 그에게 말했고 그녀는 불쾌한 사실을 숨기지 않았습니다.
"When he sent the ticket to the police, he included a note reading, 'Better late than never!'","그가 이 딱지를 경찰에 보냈을 때, 그는 '늦더라도 않는 것보다 낫다!'라고 쓴 메모를 함께 보냈다."
"you're barking up the wrong tree, homie. You're wasting a lot of taxpayer's money.",헛다리 짚는 거예요. 혈세 낭비라고요.
"I'd love that bike, but It costs an arm and a leg.",그 자전거가 갖고 싶지만 너무 비싸다.
There is an old saying that a stitch in time saves nine and I think it's better to compromise earlier instead of dispute with your neighbour.,"제 때의 한 바늘이 아홉 바늘의 수고를 구한다는 옛말이 있는데, 이웃과 다투기보다는 일찍 타협하는 것이 낫다고 생각합니다."
You must be off your rocker if you think that's a good idea!,그게 좋은 생각이라고 생각한다면 너 조금 이상한 거 같아.
The government has its head in the clouds when it comes to the rebels.,정부는 반란군에 대해서는 뜬 구름을 잡는다.
 unto others as you would have them do unto you.,남에게 당신이 대접받기 원하는 대로 대접하라.
You better wrap your head around that fact because you're gonna die alone. Just like me.,그 사실을 받아들이는 게 좋을 거야. 왜냐면 넌 혼자 죽을 거거든. 나처럼.
The researcher left no stone unturned in her search for the ancient manuscript.,그 연구원은 그 고대 원고를 찾는 데 온갖 수단을 다 동원했습니다.
"I'll let you off the hook this time, but next time you steal, you'll pay for it.",이번엔 내가 봐준다. 근데 다음 번에 또 훔치면 넌 대가를 치러야 될 거야.
It's never fun to get a taste of your own medicine.,똑같이 돌려 받는 게 절대로 기분이 좋을리가 없지.
"After they marry, they plan to move out into the country, settle down and have a family.","결혼 후에, 그들은 시골로 이사를 가서 정착하고 가정을 꾸릴 계획입니다."
Can you let me off the hook this time? I just drank a little soju.,그냥 이번만 봐주시면 안될까요? 저 소주 몇 잔 밖에 안 마셨어요.
"It seemed like every Tom, Dick, and Harry came out to purchase tickets for the movie.","마치 톰, 딕, 해리처럼 보였어. 모든 사람들이 영화 티켓을 구매하러 나왔다는 것 같았어."
She burned her bridges when she walked our angrily.,그녀가 화가 나서 걸어나갔던 게 돌이킬 수 없는 짓이 된거지.
This is to be taken with a grain of salt.,이건 대충 걸러서 들어야 하는 거야.
"When I heard that she was talking about me to other people, I was just fuming.","그녀가 다른 사람들에게 나에 대해 이야기하고 있다는 것을 들었을 때, 나는 그저 화가 났었습니다."
I was held up in traffic.,차가 막혔습니다.
My new computer can do so many different things. It’s jam-packed with features.,제 새 컴퓨터는 정말 다양한 일들을 할 수 있습니다. 기능들로 꽉 차 있습니다.
In this industry fortune favours the bold You cannot expect to be a successful action stuntman without being brave during scenes.,이 업계에서 운이 좋은 용감한 액션 스턴트맨은 장면에서 용감하지 않고서는 성공적인 액션 스턴트맨이 될 수 없습니다.
The library is the perfect place for her to work because she is such a bookworm.,그녀는 책벌레라서 도서관은 그녀가 일하기에 완벽한 장소입니다.
Don't under-estimate the Canadian wrestler it just the calm before the storm – I am sure that he will return with tremendous force and energy.,폭풍 전야의 고요함 속에서 캐나다 레슬러를 과소평가하지 마세요. 저는 그가 엄청난 힘과 에너지를 가지고 돌아올 것이라고 확신합니다.
I need you to wrap your head around this.,이것을 이해해 주세요.
His business ended up being a flop.,그의 비즈니스는 결국 실패했어요.
The police are beginning to crack down on teenagers who are out too late at night.,경찰은 너무 늦은 밤 외출하는 청소년들을 단속하기 시작했습니다.
"He never thought he would be able to put on a show, but he pulled it off.","그는 자신이 쇼를 할 수 있을 거라고는 전혀 생각하지 못했지만, 놀라운 성과를 거두었습니다."
you are comparing apples and oranges.,너는 비교 할 수 없는 것을 비교하고 있어.
So when did it all go south?,사이가 틀어진 건 언제였나요?
My department is late on its deadline. We are behind the 8-ball.,저희 부서가 마감시간에 늦었습니다. 큰일 났습니다.
Actions speak louder than words.,말보다 행동이 중요하다.
Go back to the drawing board,처음부터 다시 시작합니다
There's no method to his madness.,그의 행동에는 이유가 없다.
Porsche are a dime a dozen in this area.,이 지역에는 포르셰가 흔해 빠졌다.
This was the hottest movie out this weekend.,이 영화는 이번 주말 개봉한 영화 중에 가장 인기가 많았습니다.
She does the job fast and accurately. She's really on the ball.,그녀는 일을 빠르고 정확하게 처리해요. 정말 똑 부러져요.
She is not cut out for the swim team. She's too slow.,그녀는 수영팀에 적합하지 않습니다. 그녀는 너무 느립니다.
Don't cry over spilt milk.,엎지러진 물이야. 후회해도 소용없다.
The woman finally got in trouble because it was found out that she was running a scam.,그 여자는 사기를 치고 있었다는 사실이 밝혀져 문제가 생겼어요.
There are too many fly-by-night advertising gimmicks that do not deliver real information of the product.,진짜 정보를 전달하지 않는 돈에 환장한 해서 한몫 챙기려고만 하는 광고 속임수들이 너무 많다.
"Before leaving, double-check to make sure you have all your travel documents.",떠나기 전에 여행 서류를 모두 가지고 있는지 다시 한번 확인해 보세요.
Don't get bent out of shape over a small mistake.,작은 실수 때문에 화내지 마.
Now you see how it feels to have someone call you names. I glad I get to know this is like getting a taste of your own medicine.,너 이제 누가 너한테 욕을 하는게 어떤 기분인지 알겠네. 이게 마치 똑같이 돌려 받는 것이 이런 것이구나 알게 된 것에 다행이야.
There is a lot of mudslinging going on in politics today.,오늘날 정치권에서는 진흙탕 싸움이 많이 벌어지고 있습니다.
Management have put several proposals on the table.,경영진은 몇 개의 새로운 제안을 상정했다.
"Your son blames mine for their fight at school, but it generally takes two to tango.","아드님은 학교에서 싸운 것에 대해 제 탓을 하지만,  손뼉도 마주쳐야 소리가 납니다."
They didn't understand each other. They were not on the same wavelength.,"그들은 서로를 이해하지 못했고, 의사소통도 하지 못했습니다."
It takes one to know one. ,너야말로 사돈 남 말하네
Every dog has his day.,쥐구멍에도 볕 들 날 있다.
Get a load of those fancy cars.,저 화려한 차들을 봐라.
"By the skin of our teeth, we will.","간발의 차로, 우리는 해낼거야."
"Since he started his new business, he's really cleaning up.",그는 새 사업을 시작한 이후로 정말 큰 수익을 올리고 있습니다.
"Because it is her birthday, it is up to her what kind of birthday cake to buy.",그녀의 생일이기 때문에 어떤 생일 케이크를 사느냐는 그녀에게 달려있습니다.
"Hang in there, you only have 4 more weeks before graduation.","조금만 더 참으세요, 졸업까지 4주밖에 남지 않았네요."
"He loves his job because on Friday, he gets to work banker’s hours.",금요일은 근무시간이 짧아서 그는 자신의 일을 매우 좋아합니다.
The early bird gets the worm.,일찍 일어나는 새가 벌레를 잡는다.
"There was not enough evidence to convict him, so he beat the rap and was set free.","유죄를 선고할 증거가 충분하지 않아서, 그는 혐의를 벗고 풀려났습니다."
She is always blabbing about her supervisor’s personal life to her friends.,그녀는 항상 친구들에게 상사의 사생활에 대해 떠들어댄다.
"It was a great pleasure to meet her governor. The governor promised that, come rain or shine, he would clear all her fee areas.",그녀의 주지사를 만나서 정말 기뻤습니다. 주지사는 무슨 일이 있어도 모든 수수료 지역을 청소하겠다고 약속했습니다.
There are too many fly-by-night builders and plumbers.,신뢰 할 수 없는 한몫 챙기려고만 하는 건축업자와 배관공들이 너무 많습니다.
"The police came, and the bank robber was caught red-handed.","경찰이 왔고, 은행 강도는 현행범으로 잡혔습니다."
"An ounce of prevention is worth a pound of cure, particularly where there is no auspicious treatment.","1온스의 예방은 1파운드의 치료 가치가 있으며, 특히 상서로운 치료가 없는 경우에는 더욱 그렇습니다."
Actions speak louder than words,행동이 말보다 중요하다.
Bite off more than you can chew,무리하지마.
"If he thinks that I’m going to help him paint his house, well, he’s barking up the wrong tree.",내가 자기 집 페인트 칠하는 걸 도와줄 거라고 생각한다면 잘못 짚은 거에요.
He's got two strikes against him already with his writing and phone skills.,그는 글쓰기와 전화 실력으로 성공할 가능성이 거의 없는 어려운 상황에 처해 있습니다.
He had butterflies in his stomach while waiting for the results of his exam.,그는 시험 결과를 기다리는 동안 초조했습니다.
The supervisor is very sharp. She knows how to quickly fix any problem that may arise.,감독은 아주 능수능란해요. 어떤 문제든 빨리 해결하는 법을 알아요.
So far so good,지금까지는 좋다
